<?xml version="1.0"?>

<!-- xmlns="http://www.w3schools.com"
    xmlns:xsi="http://www.w3.org/2001/XMLSchema-instance"
    xsi:schemaLocation="./ MicroSerFor.xsd" -->
<App
    xmlns:xsi="http://www.w3.org/2001/XMLSchema-instance"
    xsi:noNamespaceSchemaLocation="./MicroSerFor.xsd">
    <Entidades>
        <nombreEntidad>Producto</nombreEntidad>
        <atributo>
            <nombreAtributo>Nombre</nombreAtributo>
            <tipoAtributo>VARCHAR(20)</tipoAtributo>
            <restricionAtributo>NOT NULL</restricionAtributo>
            <restricionAtributo>NOT NULL</restricionAtributo>
        </atributo>
        <atributoPrimario>
            <nombreAtributo>ID</nombreAtributo>
            <tipoAtributo>Integer</tipoAtributo>
            <restricionAtributo>NOT NULL</restricionAtributo>
        </atributoPrimario>
        <Servicio>
            <tipoServicio>create</tipoServicio>
            <nombreServicio>crearProducto</nombreServicio>
        </Servicio>
        <Servicio>
            <tipoServicio>readAll</tipoServicio>
            <nombreServicio>ObtenerProductos</nombreServicio>
        </Servicio>
    </Entidades>
    <Entidades>
        <nombreEntidad>Inventario</nombreEntidad>
        <atributoPrimario>
            <nombreAtributo>ID</nombreAtributo>
            <tipoAtributo>Integer</tipoAtributo>
            <restricionAtributo>NOT NULL</restricionAtributo>
        </atributoPrimario>
        <atributoPrimario>
            <nombreAtributo>IdProducto</nombreAtributo>
            <tipoAtributo>Integer</tipoAtributo>
            <restricionAtributo>NOT NULL</restricionAtributo>
        </atributoPrimario>
        <Servicio>
            <tipoServicio>create</tipoServicio>
            <nombreServicio>crearInventario</nombreServicio>
        </Servicio>
        <Servicio>
            <tipoServicio>update</tipoServicio>
            <nombreServicio>actualizarInventario</nombreServicio>
        </Servicio>
        <Servicio>
            <tipoServicio>delete</tipoServicio>
            <nombreServicio>eliminarInventario</nombreServicio>
        </Servicio>
    </Entidades>
    <Conexion>
        <url>localhost</url>
        <puerto>22</puerto>
        <database>BasePruebas</database>
        <usuario>admin</usuario>
        <password>1234</password>
        <controlador>./aqui/alla</controlador>
    </Conexion>
</App>